Name,Price,Ingredients
La Roche-Posay Anthelios UVMune 400 Invisible Fluid SPF50+ Sun Cream 50ml,£15.92,"Aqua / Water, Alcohol Denat., Triethyl Citrate, Diisopropyl Sebacate, Silica, Ethylhexyl Salicylate, Bis-Ethylhexyloxyphenol Methoxyphenyl Triazine, Ethylhexyl Triazone, Butyl Methoxydibenzoylmethane, Glycerin, Propanediol, C12-22 Alkyl Acrylate/Hydroxyethylacrylate Copolymer, Sodium Citrate, Methoxypropylamino Cyclohexenylidene Ethoxyethylcyanoacetate, Perlite, Tocopherol, Caprylic/Capric Triglyceride, Acrylates/C10-30 Alkyl Acrylate Crosspolymer, Caprylyl Glycol, Citric Acid, Diethylamino Hydroxybenzoyl Hexyl Benzoate, Drometrizole Trisiloxane, Hydroxyethylcellulose, Terephthalylidene Dicamphor Sulfonic Acid, Triethanolamine, Trisodium Ethylenediamine Disuccinate."
La Roche-Posay Cicaplast Balm B5 Multi-Purpose Repairing Balm 100ml,£18.00,Aqua Hydrogenated Polyisobutene Dimethicone Glycerin Butyrospermum Parkii Butter Panthenol Propanediol Butylene Glycol Aluminum Starch Octenylsuccinate Cetyl Peg/Ppg-1/1 Dimethicone Trihydroxystearin Ci 77891 Tocopherol Madecassoside Acetylated Glycol Stearate Magnesium Sulfate Polyglyceryl-4 Isostearate Silica Manganese Gluconate Zinc Gluconate Pentaerythrityl Tetra-Di-T-Butyl Hydroxyhydrocinnamate Capryloyl Glycine Copper Gluconate Disodium Edta Citric Acid Aluminum Hydroxide.
La Roche-Posay Cicaplast Balm B5 Multi-Purpose Repairing Balm 40ml,£10.00,Aqua Hydrogenated Polyisobutene Dimethicone Glycerin Butyrospermum Parkii Butter Panthenol Propanediol Butylene Glycol Aluminum Starch Octenylsuccinate Cetyl Peg/Ppg-1/1 Dimethicone Trihydroxystearin Ci 77891 Tocopherol Madecassoside Acetylated Glycol Stearate Magnesium Sulfate Polyglyceryl-4 Isostearate Silica Manganese Gluconate Zinc Gluconate Pentaerythrityl Tetra-Di-T-Butyl Hydroxyhydrocinnamate Capryloyl Glycine Copper Gluconate Disodium Edta Citric Acid Aluminum Hydroxide.
CeraVe Resurfacing Retinol Serum with Ceramides and Niacinamide for Blemish-Prone Skin 30ml,£21.00,"Aqua/Water/Eau, Propanediol, Dimethicone, Cetearyl Ethylhexanoate, Niacinamide, Ammonium Polyacryloyldimethyl Taurate, Dipotassium Glycyrrhizate, Hydrogenated Lecithin, Potassium Phosphate, Ceramide Np, Ceramide Ap, Ceramide Eop, Carbomer, Cetearyl Alcohol, Behentrimonium Methosulfate, Dimethiconol, Lecithin, Sodium Citrate, Retinol, Sodium Hyaluronate, Sodium Lauroyl Lactylate, Cholesterol, Phenoxyethanol, Alcohol, Isopropyl Myristate, Caprylyl Glycol, Citric Acid, Trisodium Ethylenediamine Disuccinate, Pentylene Glycol, Phytosphingosine, Xanthan Gum, Polysorbate 20, Ethylhexylglycerin."
La Roche-Posay Anthelios UVMune 400 Invisible Fluid Tinted SPF50+ 50ml,£15.92,"Aqua / Water, Alcohol Denat., Triethyl Citrate, Diisopropyl Sebacate, Silica, Ethylhexyl Salicylate, Bis-Ethylhexyloxyphenol Methoxyphenyl Triazine, Ethylhexyl Triazone, Butyl Methoxydibenzoylmethane, Glycerin, Propanediol, C12-22 Alkyl Acrylate/Hydroxyethylacrylate Copolymer, Ci 77891 / Titanium Dioxide, Methoxypropylamino Cyclohexenylidene Ethoxyethylcyanoacetate, Perlite, Tocopherol, Caprylic/Capric Triglyceride, Acrylates/C10-30 Alkyl Acrylate Crosspolymer, Caprylyl Glycol, Ci 77491 / Iron Oxides, Ci 77492 / Iron Oxides, Ci 77499 / Iron Oxides, Diethylamino Hydroxybenzoyl Hexyl Benzoate, Drometrizole Trisiloxane, Hydroxyethylcellulose, Sodium Stearoyl Glutamate, Terephthalylidene Dicamphor Sulfonic Acid, Triethanolamine, Trisodium Ethylenediamine Disuccinate, Parfum / Fragrance."
La Roche-Posay Anthelios UVMune 400 Hydrating Suncream SPF 50 50ml,£16.72,"Aqua / Water, Diisopropyl Sebacate, Alcohol Denat., Ethylhexyl Salicylate, Ethylhexyl Triazone, Bis-Ethylhexyloxyphenol Methoxyphenyl Triazine, Diisopropyl Adipate, Peg-8, Dipropylene Glycol, C12-22 Alkyl Acrylate/Hydroxyethylacrylate Copolymer, Glycerin, Drometrizole Trisiloxane, Aluminum Starch Octenylsuccinate, Butyl Methoxydibenzoylmethane, Methoxypropylamino Cyclohexenylidene Ethoxyethylcyanoacetate, Silica, Tocopherol, Diethylamino Hydroxybenzoyl Hexyl Benzoate, Acrylates Copolymer, Acrylates/C10-30 Alkyl Acrylate Crosspolymer, Caprylyl Glycol, Hydroxyacetophenone, Pentaerythrityl Tetra-Di-T-Butyl Hydroxyhydrocinnamate, Sodium Polyacrylate, Terephthalylidene Dicamphor Sulfonic Acid, Triethanolamine, Trisodium Ethylenediamine Disuccinate."
AMELIORATE Transforming Clarity Facial Serum 30ml,£11.20,"Aqua/Water/Eau, Niacinamide, Glycerin, Dicaprylyl Carbonate, Salix Alba (Willow) Bark Extract, Phenoxyethanol, Acrylates/C10-30 Alkyl Acrylate Crosspolymer, Dimethyl Isosorbide, Polyglyceryl-3 Cocoate, Polyglyceryl-4 Caprate, Polyglyceryl-6 Caprylate, Polyglyceryl-6 Ricinoleate, Butylene Glycol, Morinda Citrifolia Leaf Extract, Fragrance (Parfum), Pentylene Glycol, 3-O-Ethyl Ascorbic Acid, Ethylhexylglycerin, Lactic Acid, Serine, Sodium Lactate, Sorbitol, Urea, Hydroxypinacolone Retinoate, Biosaccharide Gum-1, Benzyl Salicylate, Hexyl Cinnamal, Rhizobian Gum, Sodium Hyaluronate, Citric Acid, Sodium Chloride, Limonene, Chlorphenesin, Allantoin, Codium Tomentosum Extract, Ecklonia Cava Extract, Gelidium Cartilagineum Extract, Hizikia Fusiforme Extract, Tocopherol, Sodium Hydroxide."
Medik8 Surface Radiance Cleanse 150ml,£22.00,"Aqua (Water), Sodium C14-16 Olefin Sulfonate, Sodium Cocoamphoacetate, Cocamidopropyl Hydroxysultaine, Glycerin, Mandelic Acid, Salicylic Acid, Citrus Aurantium Dulcis (Orange) Peel Oil, Citric Acid, Citrus Aurantium Dulcis (Orange) Fruit Extract, Sodium Hydroxide, Rubus Idaeus (Raspberry) Fruit Extract, Yucca Schidigera Root Extract, Lactic Acid, Phenoxyethanol, Citrus Grandis (Grapefruit) Peel Oil, Maltodextrin, Disodium EDTA, Garcinia Mangostana (Mangosteen) Peel Extract, Ethylhexylglycerin, Citrus Aurantifolia (Lime) Oil, Citrus Aurantium Bergamia (Bergamot) Fruit Oil, Citrus Aurantium Amara (Bitter Orange) Peel Oil, Limonene, Linalool."
First Aid Beauty BRRR-ighten and Hydrate Set (Worth £90.00),£27.00,"Moisturiser: Aqua (Water, Eau), Stearic Acid, Glycerin, C12-15 Alkyl Benzoate, Caprylic/Capric Triglyceride, Glyceryl Stearate SE, Glyceryl Stearate, Cetearyl Alcohol, Colloidal Oatmeal, Squalane, Ceramide NP, Allantoin, Chrysanthemum Parthenium (Feverfew) Extract, Camellia Sinensis Leaf Extract, Glycyrrhiza Glabra (Licorice) Root Extract, Eucalyptus Globulus (Eucalyptus) Leaf Oil, Butyrospermum Parkii (Shea) Butter, Dimethicone, Caprylyl Glycol, Xanthan Gum, Phenoxyethanol, Sodium Hydroxide, Tetrasodium EDTA."
La Roche-Posay Anthelios UVMune 400 Hydrating Suncream Tinted SPF50 50ml,£16.72,"Aqua / Water, Diisopropyl Sebacate, Alcohol Denat., Ethylhexyl Salicylate, Ethylhexyl Triazone, Bis-Ethylhexyloxyphenol Methoxyphenyl Triazine, Diisopropyl Adipate, Peg-8, Dipropylene Glycol, C12-22 Alkyl Acrylate/Hydroxyethylacrylate Copolymer, Glycerin, Drometrizole Trisiloxane, Aluminum Starch Octenylsuccinate, Butyl Methoxydibenzoylmethane, Methoxypropylamino Cyclohexenylidene Ethoxyethylcyanoacetate, Silica, Tocopherol, Diethylamino Hydroxybenzoyl Hexyl Benzoate, Ci 77891 / Titanium Dioxide, Acrylates Copolymer, Acrylates/C10-30 Alkyl Acrylate Crosspolymer, Caprylyl Glycol, Ci 77491 / Iron Oxides, Ci 77492 / Iron Oxides, Ci 77499 / Iron Oxides, Hydroxyacetophenone, Pentaerythrityl Tetra-Di-T-Butyl Hydroxyhydrocinnamate, Potassium Cetyl Phosphate, Sodium Polyacrylate, Terephthalylidene Dicamphor Sulfonic Acid, Triethanolamine, Trisodium Ethylenediamine Disuccinate, Parfum / Fragrance."
AMELIORATE Restorative Facial Mask 75ml,£8.80,"Aqua/Water/Eau, Glycerin, Butylene Glycol, Caprylic/Capric Triglyceride, Lactococcus Ferment Lysate, C12-15 Alkyl Benzoate, Oleic/Linoleic/Linolenic Polyglycerides, Hydroxyethyl Acrylate/Sodium Acryloyldimethyl Taurate Copolymer, Squalane, Phenoxyethanol, Carbomer, Fragrance (Parfum), Pentylene Glycol, Lactic Acid, Ethylhexylglycerin, Disodium EDTA, Hydrolyzed Milk Protein, Sodium Lauroyl Lactylate, Serine, Sodium Lactate, Sorbitol, Urea, Sodium Chloride, Linalool, Citronellol, Ceramide NP, Sodium Benzoate, Citrus Aurantium Dulcis (Orange) Oil, Limonene, Coumarin, Ceramide Ap, Phytosphingosine, Cholesterol, Juniperus Mexicana Oil, Alpha-Isomethyl Ionone, Xanthan Gum, Sodium Hyaluronate, Allantoin, Pelargonium Graveolens Oil, Geraniol, Sodium Hydroxide, Ceramide EOP."
AMELIORATE Resurfacing Facial Toner,£15.00,"LaH6 Skin Hydration Complex: Deeply hydrates the skin with 6 active moisturisers used at optimum levels - lactic acid, allantoin, urea, sodium lactate, serine, and hydrolysed milk protein."
SkinCeuticals Retinol 0.3 Corrective Treatment for Mature Skin 30ml?,£65.00,"Aqua / Water, Propanediol, Dimethicone, Cetearyl Ethylhexanoate, Alcohol Denat., Dipropylene Glycol, Ammonium Polyacryloyldimethyl Taurate, Hydrogenated Lecithin, Allyl Methacrylates Crosspolymer, Phenoxyethanol, Caprylyl Glycol, Isopropyl Myristate, Retinol, Polysorbate 20, Sodium Citrate, Boswellia Serrata Gum, Dimethiconol, Trisodium Ethylenediamine Disuccinate, Bisabolol, Citric Acid, Bht, Propyl Gallate (F.I.L. D225390/1)."
AMELIORATE Clarifying Facial Cleanser 200ml,£11.25,"Aqua/Water/Eau, Pentylene Glycol, Polysorbate 20, Coco-Betaine, Disodium Lauryl Sulfosuccinate, Sodium Lauroyl Sarcosinate, Niacinamide, Glycerin, Sodium Chloride, Lactic Acid, Citric Acid, Hydroxyacetophenone, Fragrance (Parfum), Salix Alba (Willow) Bark Extract, Sodium Lauroyl Oat Amino Acids, Acacia Concinna Fruit Extract, Inulin, Butylene Glycol, Benzyl Salicylate, Morinda Citrifolia Leaf Extract, Hexyl Cinnamal, Phenoxyethanol, Tetrasodium Edta, Potassium Sorbate, Sodium Benzoate, Ethylhexylglycerin, Codium Tomentosum Extract, Ecklonia Cava Extract, Gelidium Cartilagineum Extract, Hizikia Fusiforme Extract."
First Aid Beauty Face Cleanser 142g,£15.20,"Water (Aqua), SodiumCocoyl Isethionate, Glycerin, Stearic Acid, Aloe Barbadensis Leaf Juice, Stearyl Alcohol,Sodium PCA, Camellia Sinensis Leaf Extract, Chrysanthemum Parthenium (Feverfew) Extract, Glycyrrhiza Glabra (Licorice) Root Extract, Allantoin, Hydroxypropyl Methylcellulose, Disodium Cocoamphodiacetate,Coco Glucoside, Glyceryl Stearate, Disodium EDTA, Caprylyl Glycol, Phenoxyethanol."
Perricone MD Essential Fx Acyl-Glutathione Rejuvenating Moisturiser 30ml,£88.00,"Water/Aqua/Eau, Ethylhexyl Palmitate, Glycerin, Dimethicone, Cetearyl Alcohol, Glyceryl Stearate, Polysorbate 60, Palmitoyl Glycine, S-Palmitoylglutathione, Tetrahexyldecyl Ascorbate, PEG-100 Stearate, Ribose, Lactic Acid, Linum Usitatissimum (Linseed) Seed Oil, Macadamia Ternifolia Seed Oil, Phospholipids, Polyglyceryl-10 Stearate, Ethylhexylglycerin, Salvia Hispanica Seed Oil, Tocopherol, Helianthus Annuus (Sunflower) Seed Oil, Rosmarinus Officinalis (Rosemary) Leaf Extract, Tetrasodium Glutamate Diacetate, Sodium Hydroxide, Polyacrylamide, Sodium Acrylates Copolymer, Polysilicone-11, Hydrogenated Polyisobutene, C13-14 Isoparaffin, Laureth-7, Phenoxyethanol, Fragrance/Parfum, Citronellol, Hydroxycitronellal, Limonene, Linalool."
Cetaphil Healthy Radiance Night Cream with Niacinamide 50g,£15.00,"Aqua, Glycerin, Niacinamide, Butylene Glycol, Hydrogenated Polydecene, 1,2-Hexanediol, Cetearyl Alcohol, Cetearyl Olivate, Cetyl Ethylhexanoate, Sorbitan Olivate, Beeswax, Vinyl Dimethicone, Anhydroxylitol, Citric Acid, Ethylhexylglyceric, Glyceryl Stearate, Hyaluronic Acid, Hydrolyzed Cicer Seed Extract, Pentasodium Pentetate, Propanediol, Rhododendron Chrysanthum Leaf Extract, Sodium Hyaluronate, Sodium Polyacryloyldimethyl Taurate, Tocopherol, Tricholoma Matsutake Extract, Trideceth-10, Xylitol, Xylitylglucoside (Fil.1715.V00)."
Perricone MD Cold Plasma Plus+ Hydrating Sheet Mask 6-pack (Worth £108),£34.40,"Water/ Aqua/Eau, Glycerin, Isosorbide Dicaprylate, Caprylic/Capric Triglyceride, Cetearyl Alcohol, Glyceryl Stearate SE, Shea Butter Ethyl Esters, Phenethyl Alcohol, Xanthan Gum, Butylene Glycol, Caprylhydroxamic Acid, Polysorbate 20, Dimethyl Isosorbide, Copper Tripeptide-1, Phosphatidylcholine, Tetrahexyldecyl Ascorbate, Citric Acid, Dimethyl MEA, Carbomer, Sodium Lactate, Helianthus Annuus (Sunflower) Seed Oil, Sodium Benzoate, Tyrosine, Sodium Hyaluronate, Phenoxyethanol, Caprylyl Glycol, Rosmarinus Officinalis (Rosemary) Leaf Extract, Acetyl Hexapeptide-8, Potassium Sorbate, Hydrolyzed Myrtus Communis Leaf Extract, Hexylene Glycol, Acetyl Tetrapeptide-11, Acetyl Tetrapeptide-9, Palmitoyl Tripeptide-1, Tocopherol, Palmitoyl Tetrapeptide-7, Ascorbyl Palmitate, Ethylhexylglycerin. 11759-1.01."
Aveeno Face Calm and Restore Gentle PHA Exfoliating Cleanser 150ml,£8.03,"Aqua, Helianthus Annuus Seed Oil, Glycerin, Gluconolactone, Glyceryl Stearate, PEG-100 Stearate, Sorbitol, Sodium Hydroxide, Sodium Acrylates Copolymer, Carbomer, Caprylyl Glycol, PEG-40 Hydrogenated Castor oil, Avena Sativa Kernel (Oat) Oil, Lecithin, Sodium Citrate, p-Anisic Acid, Allantoin, Chlorphenesin."
Sarah Chapman Skinesis Overnight Facial (15ml),£62.00," Simmondsia Chinensis (Jojoba) Seed Oil, Cetearyl Ethylhexanoate, Cyclopentasiloxane, Cyclohexasiloxane, Di-PPG-2 Myreth-10 Adipate, Caprylic/Capric Triglyceride, Tetrahexyldecyl Ascorbate, Ethylene/Propylene/Styrene Copolymer, PEG-4, Phenyl Trimethicone, Limnanthes Alba (Meadowfoam) Seed Oil, Crambe Abyssinica Seed Oil, C12-15 Alkyl Benzoate, Cannabis Sativa Seed Oil, Butylene/Ethylene/Styrene Copolymer, Tocopheryl Linoleate/Oleate, Tocopheryl Acetate, Hydroxycinnamic Acid, Ubiquinone, Tribehenin, Teprenone, Retinyl Palmitate, Ceramide 2, PEG-10 Phytosterol, Thioctic Acid, Palmitoyl Hexapeptide-12, Adansonia Digitata Seed Oil, Cedrus Atlantica Bark Oil, Parfum (Fragrance), Jasminum Officinale Flower Extract, Santalum Spicata Wood Oil, Citrus Paradisi Peel Oil, Pelargonium Graveolens Flower Oil, Cananga Odorata Flower Oil, Rosa Damascena Flower Oil, Dalbergia Sissoo Wood Oil, Anthemis Nobilis Flower Oil, Lavandula Angustifolia Oil, Citrus Aurantium Bergamia Fruit Oil, Linalool, Limonene, Benzyl Benzoate, Citronellol, Geraniol, Farnesol, Benzyl Cinnamate, Benzyl Salicylate, Eugenol, Benzyl Alcohol, Citral, Hydroxycitronellal."
Cetaphil Healthy Radiance Day Cream with SPF15 and Niacinamide 50g,£15.00,"Aqua, Homosalate, Ethylhexyl, Methoxycinnamate, Niacinamide, Ethylhexyl Salicylate, Cetearyl Alcohol, Glycerin, Isoamyl P-Methoxycinnamate, Butyl Methoxydibenzoylmethane, Octocrylene, Dipropylene Glycol, Cetearyl Olivate, Sorbitan Olivate, 1,2-Hexanediol, Acrylates/C10-30 Alkyl Acrylate Crosspolymer, Anhydroxylitol, Caprylyl Glycol, Disodium Edta, Ethylhexyglycerin, Glyceryl Stearate, Hydrolyzed Cicer Seed Extract, Pancratium Maritimum Extract, Potassium Cetyl Phosphate, Rhododendron Chrysanthum Leaf Extract, Sodium Hydroxide, Tricholoma Matsutake Extract, Xylitol, Xylitylglucoside (Fil.1714.V00)."
Avène Gentle Exfoliating Gel 75ml,£13.00,"Avene Thermal Spring Water (Avene Aqua), Glycerin, Pentylene Glycol, Hydroxyethylacrylate/Sodium Acryloydimethyl Taurate Copolymer, Water (Aqua), Niacinamide, Coco-Glucoside, Cellulsoe, Cetrimonium Bromide, Citric Acid, Fragrance (Parfum), Glyceryl Oleate, Hydrogenated Vegetable Glycerides Citrate, Jojoba Esters, Polysorbate 60, Red 30 (Ci 73360), Sodium Salicylate, Sorbitan Isostearate, Talc, Tocopherol Trisodium Ethylenediamine Disuccinate, Zinc Gluconate."
Eucerin DermatoClean Mild Cleansing Milk 200ml,£13.50,"Aqua, Glycerin, Isopropyl Palmitate, Cetearyl Alcohol, C12-15 Alkyl Benzoate, Caprylic-Capric-Triglyceride, Octyldodecanol, Glyceryl Glucoside, Cetearyl Isononanoate, Sodium Hyaluronate, Decyl Glucoside, Sodium Citrate, Citric Acid, Glyceryl Stearate SE, Carbomer, Trisodium EDTA, Sodium Cetearyl Sulfate, Ethylparaben, 1-2-Hexanediol, Phenoxyethanol, Piroctone Olamine, Potassium Sorbate."
Eucerin Hyaluron-Filler Vitamin C Booster (1 Vial),£20.00,"Aqua, Ascorbic-Acid, Glycerin, Squalane, Isopropyl Palmitate, Dibutyl Adipate, Glyceryl Stearate, Distarch Phosphate, Methylpropanediol, Sodium Hyaluronate, Glycyrrhiza Inflata Root Extract, PEG-40 Stearate, Sorbitan Stearate, Sodium Cetearyl Sulfate, Dimethicone, Acrylic Acid-VP Crosspolymer, Xanthan Gum, Trisodium EDTA, 1-2-Hexanediol, Piroctone Olamine, Phenoxyethanol, BHT, Parfum."
First Aid Beauty Facial Radiance Pads with Glycolic and Lactic Acids Travel Size,£18.00,"Aqua/Water/Eau, Aloe Barbadensis Leaf Juice, Glycerin, Cucumis Sativus (Cucumber) Fruit  Water, Lactic Acid, Glycolic Acid, Sodium Hydroxide, Phenoxyethanol, Chrysanthemum,  Parthenium (Feverfew) Extract, Polysorbate 20, Camellia Sinensis Leaf Extract, Citrus Medica Limonum (Lemon) Peel Extract, Citrus Nobilis (Mandarin Orange) Fruit Extract, Glycyrrhiza, Glabra (Licorice) Root Extract, Potassium Sorbate, Phyllanthus Emblica Fruit Extract, Sodium Benzoate, Citric Acid, Hyaluronic Acid, Chlorphenesin, EDTA, Tetrasodium EDTA."
Cetaphil Gentle Exfoliating Cleanser 178ml,£9.38,"Aqua, Cocamidopropyl Betaine, Disodium Cocoamphodiacetate, Glycerin, Coco-Glucoside, Acrylates/C10-30 Alkyl Acrylate Crosspolymer, Bambusa Arundinacea Stem Extract, Citric Acid, Heliotropine, Panthenol, Parfum, Phenoxyethanol, Polyquaternium-10, Sodium Benzoate, Sodium Chloride, Sodium Citrate, Sodium Cocoamphoacetate, Sodium Hydroxide, Tocopheryl Acetate, Xanthan Gum."
Embryolisse Lait Crème Sensitive 15ml (Worth £6.00),£5.00,"Aqua (Water), Caprylic/Capric Triglyceride, Glycerin, Octyldodecanol, Cetearyl Alcohol, Butyrospermum Parkii (Shea) Butter, Cera Alba (Beeswax), Cetyl Phosphate, 1,2-Hexanediol, Caprylyl Glycol, Acrylates/C10-30 Alkyl Acrylate Crosspolymer, Sodium Hydroxide, Propylene Glycol, Tocopherol, Tropolone, Glycine Soja (Soybean) Oil, Hydrolyzed Soy Protein, Aloe Barbadensis Leaf Extract."
Perricone MD Multi-Action Overnight Firming Mask 59ml,£41.00,"Water/Aqua/Eau, Squalane, Caprylic/Capric Triglyceride, Isopropyl Palmitate, Cetearyl Alcohol, Cocos Nucifera (Coconut) Oil, Elaeis Guineensis (Palm) Kernel Oil, Dimethyl MEA, Glyceryl Stearate, PEG-100 Stearate, Citric Acid, Thioctic Acid, Phosphatidylcholine, Egg Shell Membrane Extract, S-Palmitoylglutathione, Butyrospermum Parkii (Shea) Butter, Acetyl Tyrosine, Xanthan Gum, Zinc Gluconate, Magnesium Aspartate, Copper Gluconate, Disodium EDTA, Dimethicone, Cetearyl Glucoside, Ceteareth-20, Caprylyl Glycol, Cetyl Alcohol, Phenoxyethanol, Sorbic Acid, Fragrance/Parfum, Citronellol, Benzyl Benzoate, Hexyl Cinnamal, Linalool."
Perricone MD Vitamin C Ester Photo-Brightening Moisturizer SPF 30 59ml,£64.00,Active Ingredient: Titanium Dioxide 4.20%.
AMELIORATE Transforming Facial Serum 30ml,£13.20,"Aqua/Water/Eau, Ammonium Lactate*, Glycerin, Lactococcus Ferment Lysate, Sclerotium Gum, Acacia Senegal Gum, Xanthan Gum, Mel Extract/Honey Extract/Extrait De Miel, Levulinic Acid, Polyglyceryl-4 Caprate, Sodium Levulinate, Fragrance (Parfum), Pentylene Glycol, Lactic Acid, Hydrolyzed Hyaluronic Acid, Hydrolyzed Milk Protein, 1,2-Hexanediol, Serine, Sodium Lactate, Sorbitol, Urea, Phytic Acid, Sodium Chloride, Linalool, Sodium Benzoate, Citronellol, Citrus Aurantium Dulcis (Orange) Oil, Limonene, Coumarin, Juniperus Mexicana Oil, Alpha-Isomethyl Ionone, Allantoin, Pelargonium Graveolens Oil."
Embryolisse Lait-Crème Concentré Multi-Purpose Moisturiser Sensitive 100ml,£21.59,"Aqua (Water), Caprylic/Capric Triglyceride, Glycerin. Octyldodecanol, Cetearyl Alcohol, Butyrospermum Parkii (Shea) Butter, Cera Alba (Beeswax), Cetyl Phosphate, 1,2-Hexanediol, Caprylyl Glycol, Acrylates/C10-30 Alkyl Acrylate Crosspolymer, Sodium Hydroxide, Propylene Glycol, Tocopherol, Tropolone, Glycine Soja (Soybean) Oil, Hydrolyzed Soy Protein, Aloe Barbadensis Leaf Extract. 98% Ingredients From Natural Origin."
First Aid Beauty Face Cleanser 57g,£10.00,"Water/Aqua/Eau, Sodium Cocoyl Isethionate, Glycerin, Stearic Acid, Hydrogenated Coconut Acid, Sodium Isethionate, Stearyl Alcohol, Phenoxyethanol, Disodium Cocoamphodiacetate, Sodium PCA, Hydroxypropyl Methylcellulose, Coco-Glucoside, Glyceryl Oleate, Sodium Chloride, Allantoin, Sodium Phytate, Chrysanthemum Parthenium (Feverfew) Extract, Citric Acid, Potassium Sorbate, Sodium Benzoate, Camellia Sinensis Leaf Extract, Glycyrrhiza Glabra (Licorice) Root Extract, Maltodextrin, Aloe Barbadensis Leaf Juice, Tocopherol, Hydrogenated Palm Glycerides Citrate, Tetrasodium EDTA."
