Name,Price,Ingredients,Product_Link,Category
Versed Day Maker Microcrystal Exfoliator 90ml,£15.50,"Water/Aqua/Eau, Microcrystalline Cellulose, Helianthus Annuus (Sunflower) Seed Oil, Cetyl Alcohol, Simmondsia Chinensis (Jojoba) Seed Oil, Glycerin, Candelilla/Jojoba/Rice Bran Polyglyceryl-3 Esters, Glyceryl Stearate, Ribes Nigrum (Black Currant) Leaf Extract, Rubus Idaeus (Raspberry) Leaf Extract, Phenoxyethanol, Xanthan Gum, Cetearyl Alcohol, Sodium Stearoyl Lactylate, Hydroxyacetophenone, C10-16 Alkyl Glucoside, Cymbopogon Citratus Leaf Oil, Ethylhexylglycerin, Arginine, Sorbic Acid, Citral.",https://www.lookfantastic.com/versed-day-maker-microcrystal-exfoliator-90ml/13191014.html,Exfoliators
Clinique Clarifying Lotion 3 400ml,£37.00,"Water\Aqua\Eau, Alcohol Denat., Salicylic Acid, Hamamelis Virginiana (Witch Hazel), Butylene Glycol, Glycerin, Trehalose, Sodium Hyaluronate, Citric Acid, Sodium Hydroxide, Disodium Edta, Bht, Phenoxyethanol, Benzophenone-4, Ext. Violet 2 (Ci 60730), Red 6 (Ci 15850), Orange 4 (Ci 15510).",https://www.lookfantastic.com/clinique-clarifying-lotion-3-400ml/11144151.html,Exfoliators
Uriage Bariederm-Cica Daily Serum 30ml,£30.90,"Aqua (Water, Eau), Glycerin, Diglycerin, 1,2-Hexanediol, Inulin, Panthenol, Sodium Polyacryloyldimethyl Taurate, Xanthan Gum, Sodium Hyaluronate, Propanediol, Centella Asiatica Leaf Extract, Citric Acid, Zinc Gluconate, Glutamylamidoethyl Indole.",https://www.lookfantastic.com/uriage-bariederm-cica-daily-serum-30ml/12954628.html,Exfoliators
Augustinus Bader The Discovery Duo 50ml,£405.00,"The Cream: Aqua/Water/Eau, Caprylic/Capric Triglyceride, Pentylene Glycol, Propylene Glycol, Glycerin, Hydrogenated Phosphatidylcholine, Sorbitol, Tocopheryl Acetate, Butylene Glycol, Butyrospermum Parkii (Shea) Butter, Xanthan Gum, Panthenol, Sodium Carbomer, Alcohol, Aloe Barbadensis Leaf Juice, Hydrolyzed Rice Protein, Retinyl Palmitate, Helianthus Annuus (Sunflower) Seed Oil, Squalane, Phenoxyethanol, Cholesterol, Hydrogenated Lecithin, Ascorbyl Palmitate, Carbomer, Ceramide NP, Lecithin, Glycine Soja (Soybean) Protein, Superoxide Dismutase, Sodium Hydroxide, Alanyl Glutamine, Arginine, Ceramide NG, Citric Acid, Dextran, Glycine, Lysine, Oleic Acid, Palmitic Acid, Palmitoyl Tripeptide-8, Phenylalanine, Proline, Scenedesmus Rubescens Extract, Ascorbic Acid, Ethylhexylglycerin, Sodium Benzoate, Tocopherol, Brassica Alba Seed Extract, Disodium EDTA, Oligopeptide-177, Sodium Ascorbate, Sodium Dextran Sulfate, Potassium Sorbate.",https://www.lookfantastic.com/augustinus-bader-the-discovery-duo-50ml/13309097.html,Exfoliators
Aurelia London The Probiotic Concentrate 30ml,£66.75,"Water, Bifida Ferment Lysate, Propylheptyl Caprylate, Glycerin, Arachidyl Alcohol, Lactose, Lactis Proteinum, Milk Protein, Chondrus Crispus (Red Algae) Powder, Glyceryl Caprylate, Behenyl Alcohol, Sodium Magnesium Fluorosilicate (Nano), Sodium Stearoyl Glutamate, Arachidyl Glucoside, Citric Acid, Sodium Phytate, Lactic Acid, Sorbic Acid, Salicylic Acid, Benzyl Alcohol, Hydroxyacetophenone.",https://www.lookfantastic.com/aurelia-london-the-probiotic-concentrate-30ml/12513953.html,Exfoliators
BeautyPro Retinol Anti-Ageing Overnight Serum 30ml,£8.95,"Aqua, Undinaria Pinnatifida Extract, Sargassum Fulvellum Extract, Ecklonia Cava Extract, Glycerin, Pentylene Glycol, Hibiscus Esculentus Fruit Extract, Caprylic/Capric Triglyceride, Dioscorea Opposita Root Extract, Polysorbate 20, Polycaprolactoneretinol, Lecithin, Linum Usitissimum Seed Extract, Salvia Hispanica Seed Extract, Decyl Glucoside, Adenosine, Ceramide NP, Sodium Magnesium Silicate, Pinus Sylvestris Leaf Oil, Phaseolus Radiatus Seed Extract, BHT, Avena Sativa Meal Extract, Limonene.",https://www.lookfantastic.com/beautypro-retinol-anti-ageing-overnight-serum-30ml/13116534.html,Exfoliators
ESPA Skin Rescue Balm 30g,£31.00,"Ricinus Communis (Castor) Seed Oil, Glycine Soja (Soybean) Oil, Hydroxystearic/Linolenic/Oleic Polyglycerides, Olus (Vegetable) Oil, Cera Alba (Beeswax), Canola Oil, Echium Plantagineum Seed Oil, Hydrogenated Vegetable Oil, Octyldodecanol, Cetyl Stearate, Limonene, Copernicia Cerifera (Carnauba) Wax, Citrus Aurantium Dulcis (Orange) Peel Oil, Caprylic/Capric Triglyceride, Cetyl Alcohol, Isostearyl Isostearate, Potassium Cetyl Phosphate, Ribes Nigrum (Black Currant) Seed Oil, Citrus Aurantium Bergamia (Bergamot) Fruit Oil, Citrus Nobilis (Mandarin Orange) Peel Oil, Calophyllum Inophyllum Seed Oil, Fragrance* (Parfum), Helianthus Annuus (Sunflower) Seed Oil Unsaponifiables, Citrus Aurantium Amara (Bitter Orange) Leaf/Twig Oil, Cymbopogon Nardus (Citronella) Oil, Linalool, Crithmum Maritimum Extract, Leptospermum Scoparium Branch/Leaf Oil, Stearic Acid, Tocopherol, Geraniol, Cardiospermum Halicacabum Flower/Leaf/Vine Extract, Helianthus Annuus (Sunflower) Seed Oil, Jasminum Officinale (Jasmine) Flower Extract, Litsea Cubeba Fruit Oil, Rosa Centifolia Flower Extract, Citral, Citric Acid, Ascorbyl Palmitate, Glyceryl Oleate, Glyceryl Stearate, Lecithin, Rosmarinus Officinalis (Rosemary) Leaf Extract, Citronellol, Benzyl Benzoate, Citrus Aurantium Amara (Bitter Orange) Flower Oil, Rosa Damascena Flower Oil. *100% Natural Fragrance. ",https://www.lookfantastic.com/espa-skin-rescue-balm/12226546.html,Exfoliators
Neutrogena Clear and Defend+ Exfoliator 125ml,£7.99,"Aqua, Glycerin, Glycolic Acid, Butylene Glycol, Polysorbate 20, Sodium Hydroxide, Citric Acid, Sodium Benzoate, Panthenol, C12-15 Alkyl Lactate, Cocamidopropyl PG-Dimonium Chloride Phosphate, Disodium EDTA, Sodium Chloride. [PR-0004773].",https://www.lookfantastic.com/neutrogena-clear-and-defend-exfoliator-125ml/14895813.html,Exfoliators
Antipodes Culture Probiotic Night Recovery Water Cream 60ml,£36.00,"Aqua (Water), Simmondsia chinensis (Jojoba) Seed Oil, Glycerine, Glyceryl Stearate, Macadamia integrifolia (Macadamia) Nut Oil, Persea gratissima (Avocado Pear) Oil, Cetearyl Glucoside, Cetearyl Alcohol, Cetyl Alcohol, Dehydroacetic Acid, Benzyl Alcohol, Tocopherol (Vitamin E), Helianthus annuus (Sunflower) Seed Oil, Daucus carota (Carrot) Seed Oil, Citrus grandis, (Grapefruit) Seed Extract, Macropiper excelsum (Kawakawa) Leaf Extract. Fragrance of Lime & Patchouli: Citral, D-Limonene, Linalool.",https://www.lookfantastic.com/antipodes-culture-probiotic-night-recovery-water-cream-60ml/12789946.html,Exfoliators
PIXI Glow Tonic Home and Away Duo Exclusive,£28.00,"Water/Aqua/Eau, Aloe Barbadensis Leaf Juice, Glycolic Acid, Butylene Glycol, Glycerin, Sodium Hydroxide, Hamamelis Virginiana (Witch Hazel) Leaf Extract, Aesculus Hippocastanum (Horse Chestnut) Seed Extract, Hexylene Glycol, Fructose, Glucose, Sucrose, Urea, Dextrin, Alanine, Glutamic Acid, Aspartic Acid, Hexyl Nicotinate, Panax Ginseng Root Extract, Ethylhexylglycerin, Disodium EDTA, Biotin, Panthenol, PPG-26-Buteth-26, PEG-40 Hydrogenated Castor Oil, Phenoxyethanol, Fragrance (Parfum), Caramel, Red 4 (CI 14700).",https://www.lookfantastic.com/pixi-glow-tonic-home-and-away-duo-exclusive/12312693.html,Exfoliators
Project Lip Lip Buff Lip Scrub 10ml,£7.15,"Ricinus Communis (Castor) Seed Oil, Sucrose, Hydroxystearic Acid,  Helianthus Annuus (Sunflower) Seed Oil, Candelilla Cera, Olea Europaea (Olive) Fruit Oil, Aroma, Carica Papaya Fruit Extract, Aloe Barbadensis Leaf Extract, Glycine Soja, Citrus Aurantium Dulcis Peel Oil Expressed, Limonene, Ci 15850, Ci 19140.",https://www.lookfantastic.com/project-lip-scrub/11928475.html,Exfoliators
philosophy Purity Made Simple Exfoliating Clay Mask 75ml,£20.30,"Aqua/Water/Eau, Kaolin, Solum Diatomeae/Diatomaceous Earth/Terre De Distomees, Propanediol, Bentonite, Decyl Glucoside, Alchol Denat., Lauryl Glucoside, Propylene Glycol, Polysilicone-11, Pvp, Xanthan Gum, Sailicylic Acid, Sodium PCA, Sodium Citrate, Citric Acid, Parfum/Fragrance, Chlorphenesin, Linalool, Disodium EDTA, Limonene, Laureth-12, Phenoxyethanol, Geraniol, Vanillyl Butyl Ether, Ethylhexylglycerin, Titanium Dioxide (Ci 77891).",https://www.lookfantastic.com/philosophy-purity-made-simple-exfoliating-clay-mask-75ml/11709854.html,Exfoliators
Super Facialist Vitamin C+ Brighten Glow Boost Skin Serum 30ml,£17.00,"Aqua (Water), Caprylic/Capric Triglyceride, Glycerin, Dimethicone, Sodium Ascorbyl Phosphate, Polyacrylamide, Phenoxyethanol, Acrylates/Vinyl Isodecanoate Crosspolymer, C13-14 Isoparaffin, Laureth-7, Disodium Edta, Parfum, 2-Bromo-2-Nitropropane-1,3-Diol, Alaria Esculenta Extract, Tocopheryl Acetate, Sodium Hyaluronate, Limonene, Citral, Hydroxycitronellal, Ci 77019 (Mica), Ci 77891 (Titanium Dioxide).",https://www.lookfantastic.com/super-facialist-vitamin-c-brighten-glow-boost-skin-serum-30ml/13209620.html,Exfoliators
RoC Double Action Eye Make-Up Remover 125ml,£10.12,"Aqua, Cyclopentasiloxane, Glycerin, Isohexadecane, Butylene Glycol, Panthenol, Copper Gluconate, Sodium Chloride, Disodium EDTA, Sodium Hydroxide, Phenoxyethanol, Methylparaben, CI 61565.",https://www.lookfantastic.com/roc-double-action-eye-make-up-remover-125ml/13447846.html,Exfoliators
Super Facialist Rose Hydrate Radiance Day Cream SPF15 - 75ml,£16.00,"Aqua (Water), Butyl Methoxydibenzoylmethane, Octocrylene, Coco-Caprylate, Ethylhexyl Methoxycinnamate, C12-15 Alkyl Benzoate, Glycerin, Polyacrylate-13, Cucumis Sativus (Cucumber) Seed Oil, Pentaerythrityl Distearate, Rosa Canina Fruit Oil, Butyrospermum Parkii (Shea) Butter, Phenoxyethanol, Polyisobutene, Parfum (Fragrance), Sodium Stearoyl Glutamate, Allantoin, Althaea Officinalis Root Extract, Benzoic Acid, Polysorbate 20, Sorbitan Isostearate, Dehydroacetic Acid, Disodium Edta, Citronellol, Geraniol, Glyceryl Acrylate/Acrylic Acid Copolymer, Salix Alba (White Willow) Bark Extract, Eugenol, Citral, Bht, Tocopherol, Rosa Damascena Extract, Benzyl Alcohol, Potassium Sorbate, Coumarin, Linalool, Sodium Benzoate.",https://www.lookfantastic.com/super-facialist-rose-hydrate-radiance-day-cream-spf15-75ml/13209613.html,Exfoliators
Clinique Anti Blemish Solutions 3-Step System,£25.00,,https://www.lookfantastic.com/clinique-anti-blemish-solutions-3-step-system/10363755.html,Exfoliators
ALGENIST Pure Genius Kit (Worth £90.00),£65.00,"C12-15 Alkyl Benzoate, Ethylhexyl Palmitate, Caprylic/Capric Triglyceride, Glycerin, Water (Aqua), Sucrose Laurate, Olea Europaea (Olive) Fruit Oil, Persea Gratissima (Avocado) Oil, Chlorella Protothecoides Oil, Algae Exopolysaccharides, Prunus Amygdalus Dulcis (Sweet Almond) Oil, Vaccinium Myrtillus Seed Oil, Retinyl Palmitate, Tocopheryl Acetate, Caprylyl Glycol, Chlorphenesin, Phenoxyethanol, Fragrance (Parfum), Chromium Oxide Greens (CI 77288), Benzyl Benzoate.",https://www.lookfantastic.com/algenist-pure-genius-kit/11499460.html,Exfoliators
FaceGym Liftwear Lift and Brighten Vitamin C and Bioferment Gel-Cream 15ml,£20.00,"Aqua, Glycerin, Cetearyl Ethylhexanoate, Propanediol, Helianthus Annuus (Sunflower) Seed Oil, Niacinamide, Betaine, Ammonium Acryloyldimethyltaurate/Vp Copolymer, Xylitylglucoside, Ascorbyl Tetraisopalmitate, Maltodextrin, Anhydroxylitol, Xylitol, Glycogen, Sodium Stearoyl Glutamate, Hydrolyzed Jojoba Esters, Sodium Pca, Glucose, Hyaluronic Acid, Lupinus Albus Seed Extract, Pca, Sucrose, Plankton Extract, Tocopherol, Serine, Alanine, Glycine, 1,2-Hexanediol, Lecithin, Bacillus Ferment, Glutamic Acid, Lysine Hcl, Threonine, Biosaccharide Gum-4, Arginine, Proline, Succinic Acid, Sodium Lactate, Citric Acid, Parfum, Phenoxyethanol, Hydroxyacetophenone.",https://www.lookfantastic.com/facegym-liftwear-lift-and-brighten-vitamin-c-and-bioferment-gel-cream-15ml/13860388.html,Exfoliators
Shiseido WASO Soft and Cushy Polisher 75ml,£26.00,"Water(Aqua/Eau), Microcrystalline Cellulose, Sd Alcohol 40-B (Alcohol Denat.), Cellulose, Dipropylene Glycol, Hydrolyzed Corn Starch, Glycerin, Dimethicone, Cetyl Ethylhexanoate, Phenoxyethanol, Carbomer, Hydroxypropyl Methylcellulose, Fragrance (Parfum), Betaine, Potassium Hydroxide, Acrylates/C10-30 Alkyl Acrylate Crosspolymer, Xanthan Gum, Limonene, Hexyl Cinnamal, Butylphenyl Methylpropional, Sodium Metaphosphate, Disodium Edta, Hydrogenated Lecithin, Iron Oxides (Ci 77492).",https://www.lookfantastic.com/shiseido-waso-soft-and-cushy-polisher-75ml/11529691.html,Exfoliators
Clinique Smart Clinical MD Age Transformer Revolumize 50ml,£70.00,,https://www.lookfantastic.com/clinique-smart-clinical-md-age-transformer-revolumize-50ml/12255586.html,Exfoliators
Clinique Smart Clinical MD Age Transformer Resculpt 50ml,£70.00,,https://www.lookfantastic.com/clinique-smart-clinical-md-age-transformer-resculpt-50ml/12255585.html,Exfoliators
Ecooking Face Scrub 100ml,£25.95,"Prunus Amygdalus Dulcis Oil*, Hydrogenated Vegetable Oil*, Butyrospermum Parkii Butter**, Cetearyl Ethylhexanoate**, Prunus Amygdalus Dulcis Shell Powder**, Tocopherol**, Helianthus Annuus Seed Oil**.",https://www.lookfantastic.com/ecooking-face-scrub-100ml/11925885.html,Exfoliators
Indeed Labs Gluconolactone Toner 150ml,£19.99,"Water (Aqua/Eau), Gluconolactone, Betaine, Propanediol, Propylene Glycol, Humulus Lupulus (Hops) Extract, Hypericum Perforatum Flower/Leaf/Stem Extract, Arctium Majus Root Extract, Salvia Officinalis (Sage) Flower/Leaf/Stem Extract, Calendula Officinalis Flower Extract, Saponaria Officinalis Leaf/Root Extract, Citrus Limon (Lemon Flower/Leaf/Stem Extract, Sodium Benzoate, Triethanolamine, EDTA.",https://www.lookfantastic.com/indeed-labs-gluconolactone-toner-150ml/13030848.html,Exfoliators
Clinique Smart Clinical MD Age Transformer Duo (Resculpt & Revolumize) 50ml,£70.00,"Water\Aqua\Eau , Glycerin , Caprylyl Methicone , Butylene Glycol , Alcohol Denat. , Dimethicone , Isododecane , Peg-10 Dimethicone , Dipropylene Glycol , Prunus Amygdalus Dulcis (Sweet Almond) Seed Extract , Cucumis Melo (Melon) Fruit Extract , Persea Gratissima (Avocado) Oil , Saccharomyces Lysate Extract , Acetyl Glucosamine , Porphyridium Cruentum Extract , Dipeptide Diaminobutyroyl Benzylamide Diacetate , Acetyl Hexapeptide-8 , Palmitoyl Tetrapeptide-7 , Acetyl Octapeptide-3 , Cholesterol , Decarboxy Carnosine Hcl , Acetyl Carnitine Hcl , Caffeine , Creatine , Sigesbeckia Orientalis (St. Paul'S Wort) Extract , Palmitoyl Tripeptide-1 , Polygonum Cuspidatum Root Extract , Centella Asiatica (Hydrocotyl) Extract , Glycine Soja (Soybean) Protein , Ergothioneine , Propylene Glycol Dicaprylate , Peg-150 , Lauryl Peg-9 Polydimethylsiloxyethyl Dimethicone , Jojoba Esters , Whey Protein\Lactis Protein\Protéine Du Petit-Lait , Adenosine Phosphate , Tocopheryl Acetate , Lactic Acid , Yeast Extract\Faex\Extrait De Levure , Linoleic Acid , Sodium Hyaluronate , Phytantriol , Glycine Soja (Soybean) Seed Extract , Disteardimonium Hectorite , Propylene Carbonate , Menthanediol , Hydroxypropyl Methylcellulose , Pullulan , Polyquaternium-51 , Sodium Hydroxide , Calcium Chloride , Carbomer , Sea Whip Extract , Polysorbate 20 , Caprylyl Glycol , Tetrahexyldecyl Ascorbate , Citric Acid , Potassium Sulfate , Sodium Hexametaphosphate , Sodium Citrate , Potassium Sorbate , Sodium Benzoate , Phenoxyethanol Rds Product Name: Smart Clinical Multi-Dim A/C Revol Division: Cl (Clinique)Ingredients: Water\Aqua\Eau , Butylene Glycol , Butyrospermum Parkii (Shea Butter) , Cetearyl Alcohol , Hydrogenated Polyisobutene , Phenyl Trimethicone , Sucrose , Glycerin , Polyglyceryl-3 Beeswax , Cetyl Esters , Isostearyl Neopentanoate , Peg-100 Stearate , Hdi/Trimethylol Hexyllactone Crosspolymer , Cetearyl Glucoside , Acetyl Glucosamine , Sigesbeckia Orientalis (St. Paul'S Wort) Extract , Yeast Extract\Faex\Extrait De Levure , Methyl Glucose Sesquistearate , Centaurium Erythraea (Centaury) Extract , Micrococcus Lysate , Polysilicone-11 , Acetyl Octapeptide-3 , Acetyl Hexapeptide-8 , Ergothioneine , Biotin , Whey Protein\Lactis Protein\Protéine Du Petit-Lait , Ursolic Acid , Dipeptide Diaminobutyroyl Benzylamide Diacetate , Glycine Soja (Soybean) Protein , Tocopheryl Acetate , Camellia Sinensis Leaf Extract , Isoleucine , Saccharomyces Ferment Filtrate , Leucine , Soy Amino Acids , Carbomer , Polymethyl Methacrylate , Hydroxyethyl Urea , Caffeine , Caprylyl Glycol , Pyrus Malus (Apple) Fruit Extract , Polybutene , Hydrolyzed Soy Protein , Dimethicone , Sodium Hyaluronate , Linoleic Acid , Stearic Acid , Aminomethyl Propanol , Adenosine Phosphate , Acetyl Carnitine Hcl , Creatine , Menthanediol , Lecithin , Aminopropyl Ascorbyl Phosphate , Silica , 1,2-Hexanediol , Calcium Chloride , Hydroxyethylcellulose , Sodium Citrate , Citric Acid , Disodium Edta , Potassium Sorbate , Bht , Sodium Benzoate , Sodium Dehydroacetate , Phenoxyethanol , Ext. Violet 2 (Ci 60730) , Red 33 (Ci 17200).",https://www.lookfantastic.com/clinique-smart-clinical-md-age-transformer-duo-resculpt-revolumize-50ml/12255587.html,Exfoliators
ManCave Olivestone Face Scrub 100ml,£8.00,"Aqua (Water), Aloe Barbadensis Leaf Juice, Caprylic/Capric Triglyceride, Cetyl Alcohol, Ethylhexyl Stearate, Glycerin, Polyglyceryl-3-Methylglucose Distearate, Butyrospermum Parkii (Shea Butter), Helianthus Annuus (Sunflower) Seed Oil, Zea Mays (Corn) Starch, Ethylhexyl Salicylate, Octocrylene, Cetearyl Glucoside, Borago Officinalis Seed Oil, Arginine, Caffeine, Tocopheryl Acetate, Parfum (Fragrance), Bulnesia Sarmientoi Wood Oil, Rosmarinus Officinalis (Rosemary) Leaf Oil, Lavandula Hybrida Oil, Cedrus Atlantica Bark Oil, Abies Sibirica Oil, Eucalyptus Globulus Leaf Oil, Citrus Aurantifolia (Lime) Oil, Artemisia Herba-Alba Oil, Origanum Majorana Herb Oil, Juniperus Communis Fruit Oil, Piper Nigrum (Pepper) Fruit Oil, Thymus Vulgaris (Thyme) Flower/Leaf Oil, Abies Balsamea Extract, Sodium Polyacrylate, Cetyl Esters, Phenoxyethanol, Benzoic Acid, Dehydroacetic Acid, Citric Acid, Potassium Sorbate, Benzyl Salicylate, Coumarin, Hexyl Cinnamal, Limonene, Linalool, Alpha-Isomethyl Ionone.",https://www.lookfantastic.com/mancave-olivestone-face-scrub-100ml/11355662.html,Exfoliators
BeautyPro SPA at Home: Hand and Foot Renewal Set (Worth £17.85),£16.00," Salicylic Acid (BHA Complex from fruit extracts), Glycolic Acid (AHA Complex from fruit extracts), Sage, Anise, Lavender, Olive, Acerola, Kiwi, Banana, Honeysuckle, Peach, Chamomile, Gingko Biloba, Rosemary, Vitamin-E, Lemon and Lime.",https://www.lookfantastic.com/beautypro-spa-at-home-hand-and-foot-renewal-set/11859100.html,Exfoliators
Kate Somerville ExfoliKate Introduction Kit,£63.00,"Water, Lactic Acid, Silica, Glycine Soja (Soybean) Oil, Pectin, Cetearyl Alcohol, Carica Papaya (Papaya) Fruit, Ceteareth-20, Cetyl Alcohol, Phenoxyethanol, Dehydroxanthan Gum, Glyceryl Stearate, PEG-100 Stearate, Salicylic Acid, Lactobacillus/Pumpkin Ferment Extract, Alcohol Denat., Sorbic Acid, Cinnamal, Honey/Mel/Miel, Citrus Aurantium Bergamia (Bergamot) Fruit Oil, Eugenol, Potassium Sorbate, Limonene, Linalool, Lavandula Angustifolia (Lavender) Oil, Beta-Carotene, Chlorophyllin-Copper Complex, Aloe Barbadensis Leaf Juice Powder, Bromelain, Papain, Retinyl Palmitate, Tocopheryl Acetate, Cinnamomum Cassia Leaf Oil, Acetic Acid, Pogostemon Cablin Oil, Geranium Maculatum Oil, Aniba Rosaeodora (Rosewood) Wood Extract, Citrus Aurantium Dulcis (Orange) Peel Oil.",https://www.lookfantastic.com/kate-somerville-exfolikate-introduction-kit/12753664.html,Exfoliators
BeautyPro SPA at Home: Restore and Renew Set (Worth £18.15),£16.00," Aqua, Glycerin, Propylene Glycol, Glycereth-26, Hydrolyzed Collagen, Sodium PCA, Camellia Sinensis Leaf Extract, Jania Rubens Extract, Sodium Hyaluronate, Butylene Glycol, Caprylhydroxamic Acid, 1, 2-Hexanediol, Caprylyl Glycol, Boswellia Serrata Resin Extract, Peg-60 Hydrogenated Castor Oil, Natto Gum, Wheat Amino Acids, Butylene Glycol, Punica Granatum Fruit Extract, Hamamelis Virginiana (Witch Hazel) Extract, Tocopheryl Acetate, Disodium  EDTA, Triethanolamine, Hydroxyethylcellulose, Carbomer, Parfum.",https://www.lookfantastic.com/beautypro-spa-at-home-restore-and-renew-set/11859102.html,Exfoliators
L'Occitane Illuminating Scrub Reine Blanche 75ml,£35.80,,https://www.lookfantastic.com/l-occitane-illuminating-scrub-reine-blanche-75ml/13417533.html,Exfoliators
L'Occitane Cream to-Milk Facial Exfoliator 75ml,£21.80,,https://www.lookfantastic.com/l-occitane-cream-to-milk-facial-exfoliator-75ml/13417505.html,Exfoliators
Lancer Skincare The Method: Polish Sensitive Skin (120g),£72.50,"Glycerin, Peg-8, Sodium Bicarbonate, Quartz, Oleth-20, Trihydroxystearin, Silica, Glyceryl Stearate, Peg-100 Stearate, Zingiber Officinale (Ginger) Root Extract, Helianthus Annuus (Sunflower) Seed Oil, Anthemis Nobilis Flower Oil, Lavandula Angustifolia (Lavender) Oil, Retinyl Palmitate, Bisabolol, Tocopheryl Acetate, Linalool.",https://www.lookfantastic.com/lancer-skincare-the-method-polish-sensitive-skin-120g/11166676.html,Exfoliators
Lancer Skincare The Method: Polish Blemish Control (120g),£72.50,"Butylene Glycol, Sodium Bicarbonate, Quartz, Peg-8, Glycerin, Oleth-20, Trihydroxystearin Silica, Glyceryl Stearate, Peg-100 Stearate, Lactobacillus/Pumpkin Ferment Extract, Syringa Vulgaris (Lilac) Leaf Cell Culture Extract, Lactobacillus/Punica Granatum Fruit Ferment Extract, Leuconostoc/Radish Root Ferment Filtrate, Hydrolyzed Algae Extract, Lavandula Angustifolia (Lavender) Oil, Mentha Piperita (Peppermint) Oil, Helianthus Annuus (Sunflower) Seed Oil, Retinyl Palmitate, Tocopheryl Acetate, Salicylic Acid, Water (Aqua), Maltodextrin, Sorbic Acid, Linalool.",https://www.lookfantastic.com/lancer-skincare-the-method-blemish-control-polish-4.2-oz/11166677.html,Exfoliators
So Eco Konjac Face Sponge - Charcoal,£7.00,,https://www.lookfantastic.com/so-eco-konjac-face-sponge-charcoal/12328553.html,Exfoliators
The Konjac Sponge Company Mythical Unicorn Prancing Konjac Sponge Box and Hook - White 30g,£10.99,100% Konjac,https://www.lookfantastic.com/the-konjac-sponge-company-mythical-unicorn-prancing-konjac-sponge-box-and-hook-white-30g/11959131.html,Exfoliators
Jack Black Face Buff Energizing Scrub (177ml),£26.00,"Water, Glyceryl Stearate, Polylactic Acid, Disodium Cocoamphodiacetate, Hexylene Glycol, Cetyl Alcohol, Sodium C14-16 Olefin Sulfonate, Ceteth-2, Menthyl PCA, Caprylic/Capric Triglyceride, Simmondsia Chinensis (Jojoba) Seed Oil, Allantoin, Mentha Arvensis Leaf Extract, Mentha Arvensis Leaf Oil, Glycerin, Aloe Barbadensis Leaf Juice*, Ascorbic Acid, Calendula Officinalis Flower Extract, Cucumis Sativus (Cucumber) Fruit Extract*, Glycyrrhiza Glabra (Licorice) Root Extract*, Phenoxyethanol, Polysorbate 80, Isohexadecane, Sodium Acrylate/Sodium Acryloyldimethyl Taurate/Acrylamide Copolymer, Fragrance, Magnesium Aluminum Silicate, Chlorphenesin, Hydrogenated Camelina Sativa Seed Oil, Copernicia Cerifera (Carnauba) Wax, Ethylhexylglycerin *Certified Organic.",https://www.lookfantastic.com/jack-black-face-buff-energizing-scrub-177ml/11208042.html,Exfoliators
Clé de Peau Beauté Intensive Fortifying Cream 50g,£130.00,"Water (Aqua/Eau), Butylene Glycol, Alcohol Denat., Dipropylene Glycol, Peg/Ppg-14/7 Dimethyl Ether, Betaine, Glycerin, Trehalose, Phenoxyethanol, Carbomer, Sodium Citrate, Theanine, Ppg-13-Decyltetradeceth-24, Citric Acid, Erythritol, Fructose, Xanthan Gum, Dipotassium Glycyrrhizate, Allantoin, Fragrance (Parfum), Disodium Edta, Sodium Acetylated Hyaluronate, Tremella Fuciformis Polysaccharide, Potassium Hydroxide, Lilium Candidum Bulb Extract, Hexyl Cinnamal, Alpha-Isomethyl Ionone, Citronellol, Angelica Acutiloba Root Extract, Centaurea Cyanus Flower Extract, Limonene, Linalool, Eucheuma Serra/Grateloupia Sparsa/Saccharina Angustata/Ulva Linza/Undaria Pinnatifida Extract, Panax Ginseng Root Extract, Hydrolyzed Silk, Glycine, Inositol, Saccharina Angustata/Undaria Pinnatifida Extract, Rosa Canina Fruit Extract, Fagus Sylvatica Bud Extract, Perilla Ocymoides Leaf Extract, Tocopherol, Hydrolyzed Conchiolin Protein, Potentilla Erecta Root Extract, Bupleurum Falcatum Root Extract.",https://www.lookfantastic.com/cle-de-peau-beaute-intensive-fortifying-cream-50g/13309960.html,Exfoliators
BeautyPro Pink Clay Mask,£6.95,"Aqua, Kaolin, Butylene Glycol, Bentonite, Polysorbate 80, 1,2-Hexanediol, Glycerin, Calamine, Niacinamide, Adenosine, Magnesium Aluminum Silicate, Stearic Acid, Xanthan Gum, Tromethamine, Silkworm Cocoon Extract, Allantoin, Panthenol, Ethylhexylglycerin, Dipotassium Glycyrrhizate, Disodium EDTA, Hydrolyzed Collagen, Portulaca Oleracea Extract, Morus Alba Leaf Extract, Morus Alba Fruit Extract, Lycium Chinense Fruit Extract, Ethyl Hexanediol, Phenoxyethanol, Parfum.",https://www.lookfantastic.com/beautypro-pink-clay-mask/11708074.html,Exfoliators
Dr. Levy Limited Edition The Stem Cell Miracle Reboot Cure Set,£95.00,"Aqua (Water), Niacinamide, Propanediol, Glycerin, Argania Spinosa Callus Culture Extract, Malus Domestica Fruit Cell Culture Extract, Sodium Hyaluronate, Retinyl Palmitate, Ascorbyl Tetraisopalmitate, Tocopheryl Acetate, Melissa Officinalis Leaf Extract, Borago Officinalis Seed Oil, Tetradecyl Aminobutyroylvalylaminobutyric Urea Trifluoroacetate, Aloe Barbadensis Leaf Extract, Phenoxyethanol, Ethylhexylglycerin, Panthenol, Chlorphenesin, Acrylates/C10-30 Alkyl Acrylate Crosspolymer, Pyridoxine Hcl, Ppg-26-Buteth-26, Peg-40 Hydrogenated Castor Oil, Lecithin, Parfum (Fragrance), Sodium Hydroxide, Caprylic/Capric Triglyceride, Carnosine, Xanthan Gum, Magnesium Chloride, Alcohol, Cyclodextrin.",https://www.lookfantastic.com/dr.-levy-limited-edition-the-stem-cell-miracle-reboot-cure-set/12772509.html,Exfoliators
