Name,Price,Ingredients,Product_Link,Category
Biossance Squalane and Glycolic Renewal Mask 75ml,£38.00,"Water/Aqua, Glycerin, Glycolic Acid, Squalane, Caprylic/Capric Triglyceride, Stearyl Alcohol, Arachidyl Alcohol, Clay Mineral Oxides, Behenyl Alcohol, Sodium Hydroxide, Lactic Acid, Pyrus Malus (Apple) Fruit Extract, Capryloyl Glycerin/Sebacic Acid Copolymer, Vaccinium Myrtillus Fruit Extract, Saccharum Officinarum (Sugarcane) Extract, Acer Saccharum (Sugar Maple) Extract, Kaolin, Sodium Hyaluronate, Xanthan Gum, Diheptyl Succinate, Citrus Aurantium Dulcis (Orange) Fruit Extract, Citrus Limon (Lemon) Fruit Extract, Citric Acid, Tartaric Acid, Glycyrrhiza Glabra (Licorice) Root Extract, Citrus Limon (Lemon) Peel Oil, Montmorillonite, Illite, Acacia Senegal Gum, Biosaccharide Gum-1, Arachidyl Glucoside, Polyacrylate Crosspolymer-6, Phenoxyethanol, Ethylhexylglycerin, Sodium Phytate, Limonene.",https://www.lookfantastic.com/biossance-squalane-and-glycolic-renewal-mask-75ml/12766630.html,Exfoliators
Kate Somerville Liquid ExfoliKate Triple Acid Resurfacing Treatment 120ml,£58.00,"Aqua/Water/Eau, Pelargonium Graveolens Flower/Leaf/Stem Water, Lactic Acid, Sodium Hydroxide, Glycolic Acid, Propanediol, Phytic Acid, Glycerin, Papain, Boswellia Serrata Extract, Mel Extract/Honey Extract/Extrait De Miel, Camellia Sinensis Leaf Extract, Aspalathus Linearis Extract, Bromelain, Microcitrus Australasica Fruit Extract, Tetrapeptide-14, Lactobacillus/Pumpkin Fruit Ferment Filtrate, Leuconostoc/Radish Root Ferment Filtrate, 1,2-Hexanediol, Butylene Glycol, Citric Acid, Malic Acid, Tartaric Acid, Caprylhydroxamic Acid, Phenoxyethanol, Sodium Benzoate, Maltodextrin, Citronellol, Geraniol, Linalool.",https://www.lookfantastic.com/kate-somerville-liquid-exfolikate-triple-acid-resurfacing-treatment-120ml/12753688.html,Exfoliators
Liz Earle Superskin Microdermabrasion Polish 75ml,£32.00,"Aqua (Water), Pumice, Glycerin, Borago Officinalis Seed Oil, Butyrospermum Parkii (Shea) Butter, Rosa Rubiginosa Seed Oil, Vaccinium Macrocarpon (Cranberry) Seed Oil, Cetearyl Alcohol, Diheptyl Succinate, Cetearyl Olivate, Vaccinium Myrtillus (Bilberry) Fruit Extract, Citrus Aurantium Amara (Petitgrain) Leaf/Twig Oil, Punica Granatum Fruit Extract, Lavandula Hybrida (Lavandin) Oil, Saccharum Officinarum (Sugar Cane) Extract, Anthemis Nobilis Flower Oil, Citrus Aurantium Dulcis (Orange) Fruit Extract, Citrus Limon (Lemon) Fruit Extract, Acer Saccharum (Sugar Maple) Extract, Citrus Aurantium Amara (Neroli) Flower Oil, Sodium Polyacrylate, Sorbitan Olivate, Phenoxyethanol, Caprylyl Glycol, Linalool, Sodium Benzoate, Xanthan Gum, Ethylhexylglycerin, Capryloyl Glycerin/Sebacic Acid Copolymer, Citric Acid, Parfum (Fragrance), Sodium Phytate, Limonene, Geraniol, Tocopherol (Vitamin E), Potassium Sorbate, Glycine Soja (Soybean) Oil, Alcohol, Sodium Hydroxide.",https://www.lookfantastic.com/liz-earle-superskin-microdermabrasion-polish-75ml/13643876.html,Exfoliators
Perricone MD FG High Potency Hyaluronic Intensive Body Therapy 6 oz,£57.00,"Water/Aqua/Eau, Helianthus Annuus (Sunflower) Seed Oil, Coconut Alkanes, Glycerin, Cetearyl Alcohol, Cetearyl Olivate, Glyceryl Stearate, Sorbitan Olivate, Caprylic/Capric Triglyceride, Phenoxyethanol, Butyrospermum Parkii (Shea) Butter, Dimethyl MEA, Sodium Stearoyl Glutamate, Citric Acid, Hydroxyethyl Acrylate/Sodium Acryloyldimethyl Taurate Copolymer, Coco-Caprylate/Caprate, Ethylhexylglycerin, Squalane, Pentylene Glycol, Alaria Esculenta Extract, Polysorbate 60, Sorbitan Isostearate, Disodium Acetyl Glucosamine Phosphate, Sodium Glucuronate, Sodium Acetylated Hyaluronate, Sodium Hyaluronate, Sodium Hyaluronate Crosspolymer, Magnesium Sulfate, Hyaluronic Acid, Spermidine.",https://www.lookfantastic.com/perricone-md-fg-high-potency-hyaluronic-intensive-body-therapy-6-oz/13658703.html,Exfoliators
"Burt's Bees Hand Cream with Shea Butter, Lavender and Honey 28.3g",£7.49,"Water, Glycerin, Cetyl Alcohol, Cocos Nucifera (Coconut) Oil, Helianthus Annuus (Sunflower) Seed Oil, Adansonia Digitata Oil, Caprylic/Capric Triglyceride, Fragrance (Natural Fragrance), Lavandula Angustifolia (Lavender) Flower Extract, Honey, Butyrospermum Parkii (Shea) Butter, Simmondsia Chinensis (Jojoba) Butter, Theobroma Grandiflorum Seed Butter, Beeswax, Ricinus Communis (Castor) Seed Oil, Citrullus Lanatus (Watermelon) Seed Oil, Cucurbita Pepo (Pumpkin) Seed Oil, Acacia Decurrens Flower Wax, Helianthus Annuus (Sunflower) Seed Wax, Tocopherol, Jojoba Esters, Hydrogenated Castor Oil, Glycine Soja (Soybean) Oil, Polyglycerin-3, Biosaccharide Gum-1, Glyceryl Caprylate, Sodium Anisate, Sodium Levulinate, Glyceryl Stearate Citrate, Stearic Acid, Sucrose Stearate, Sodium Stearoyl Lactylate, Magnesium Aluminum Silicate, Sucrose Polystearate, Xanthan Gum, Arginine, Lactic Acid, Phenoxyethanol, Citronellol, Coumarin, Geraniol, Limonene, Linalool.",https://www.lookfantastic.com/burt-s-bees-hand-cream-with-shea-butter-lavender-and-honey-28.3g/12100119.html,Exfoliators
Aromatherapy Associates Resurfacing Exfoliator 50ml,£40.00,"Aqua (Water), Caprylic/Capric Triglyceride, Vaccinium Myrtillus (Blueberry) Seedcake Powder, Glyceryl Stearate SE, Butyrospermum Parkii (Shea) Butter, Cetearyl Alcohol, Rubus Idaeus (Raspberry) Seed Powder, Glycerin, Niacinamide, Theobroma Cacao (Cocoa) Seed Butter, Vitis Vinifera (Grape) Seed Oil, Phenoxyethanol, Cetearyl Olivate, Carbomer, Sorbitan Olivate, Sodium Hydroxide, Vaccinium Myrtillus (Blueberry) Fruit Extract, Pogostemon Cablin (Patchouli) Leaf Oil, Saccharum Officinarum (Sugar Cane) Extract, Sodium Phytate, Ethylhexylglycerin, Boswellia Carterii Resin Extract, Lavandula Angustifolia (Lavender) Oil, Citrus Aurantium Dulcis (Orange) Fruit Extract, Citrus Limon (Lemon) Fruit Extract, Parfum (Fragrance)**, Fusanus Spicatus (Sandalwood) Wood Oil, Acer Saccharum (Sugar Maple) Extract, Cananga Odorata (Ylang Ylang) Flower Oil, Tocopheryl Acetate, Vetiveria Zizanoides (Vetiver) Root Oil, Tanacetum Annuum (Blue Tansy) Flower Oil, Anthemis Nobilis (Chamomile) Flower Oil, Jasminum Sambac (Jasmine) Flower Extract, Cistus Incanus Flower/Leaf/Stem Extract, Aloe Barbadensis Leaf Powder, Phenylpropanol, 1,2-Hexanediol, Linalool*, Farnesol*, Benzyl Benzoate*, Limonene*. *Natural Essential Oil Contents **Natural Plant Extracts.",https://www.lookfantastic.com/aromatherapy-associates-resurfacing-exfoliator-50ml/14265786.html,Exfoliators
Grown Alchemist Hydra-Repair Eye Balm 15ml,£74.00,"Ricinus Communis (Castor) Seed Oil (*Plant/Plante), Undecane, Tridecane, Camellia Sinensis Oil, Cera Alba (Beeswax/Cire d’abeille), Hydrogenated Castor Oil, Butyrospermum Parkii (Shea) Butter, Sclerocarya Birrea (Marula) Seed Oil, Plukenetia Volubilis (Sacha Inchi) Oil, Lavandula Angustifolia (Lavender) Oil, Rosmarinus Officinalis (Rosemary) Leaf Oil, Tocopherol (Vitamin E/Vitamine E), Helianthus Annuus (Sunflower/Tournesol) Seed Oil (Helianthus Seed Extract/Extrait de Graines d’hélianthe), Calendula Officinalis (Marigold/Souci) Extract, Simmondsia Chinensis (Jojoba) Oil, Argania Spinosa (Argan/Argan) Oil, Linalool (*Plant/Plante), Limonene (*Plant/Plante). (*Plant Derived/Dérivé des Plantes).",https://www.lookfantastic.com/grown-alchemist-hydra-repair-eye-balm-15ml/12957200.html,Exfoliators
AHAVA Facial Mud Exfoliator 96ml,£29.00,"Aqua (Mineral Spring Water), Sodium Trideceth Sulfate, Cellulose, Cetearyl Alcohol, Sodium Lauroamphoacetate, Caprylic/Capric Triglyceride, Calcium Carbonate, Propanediol (Corn derived Glycol), Silt (Dead Sea Mud), Cocamide MEA, Ethylhexyl Palmitate, Ethylhexyl Hydroxystearate, Glycol Stearate, Cetyl Alcohol, Silica, Glyceryl Stearate, Lactic Acid, Isopropyl Alcohol, PEG-100 Stearate, Hexylene Glycol, Ceteareth-20, Caprylyl Glycol, Chlorphenesin, Phenoxyethanol, Sodium Chloride, Disodium Lauroamphodiacetate, Hydroxypropylcellulose, Magnesium Aluminum Silicate, Hydroxyethylcellulose, Tocopherol (Vitamin E), Maris Sal (Dead Sea Salt), Panthenyl Triacetate.",https://www.lookfantastic.com/ahava-facial-mud-exfoliator-96ml/11396228.html,Exfoliators
Dr. Levy Booster Cream 50ml,£232.00,"Aqua (Water), C12-20 Acid Peg-8 Ester, Caprylic/Capric Triglyceride, Squalane, Niacinamide, Butylene Glycol, Coco-Caprylate/Caprate, Glycerin, Myristyl Myristate, Butyrospermum Parkii (Shea) Butter, Argania Spinosa Callus Culture Extract, Malus Domestica Fruit Cell Culture Extract, Melissa Officinalis Leaf Extract, Sodium Hyaluronate, Retinyl Palmitate, Rosmarinus Officinalis (Rosemary) Leaf Extract, Borago Officinalis Seed Oil, Tocopheryl Acetate, Ascorbyl Tetraisopalmitate, Tocopherol, Tetradecyl Aminobutyroylvalylaminobutyric Urea Trifluoroacetate, Aloe Barbadensis Leaf Juice, Psilanthus Bengalensis Leaf Cell Culture Extract, Brassica Campestris (Rapeseed) Seed Oil, Potassium Cetyl Phosphate, Phenoxyethanol, Panthenol, Carbomer, Ethylhexylglycerin, Pyridoxine Hcl, Polysorbate 60, Lecithin, Sodium Hydroxide, Carnosine, Xanthan Gum, Cyclodextrin, Tocotrienols, Hydroxyethyl Acrylate/Sodium Acryloyldimethyl Taurate Copolymer, Elaeis Guineensis (Palm) Oil, Magnesium Chloride, Squalene, Disodium Edta, Dimethicone, Phytosterols, Sorbitan Isostearate, Alcohol, Parfum (Fragrance).",https://www.lookfantastic.com/dr.-levy-booster-cream-50ml/12766606.html,Exfoliators
111SKIN Antioxidant Energising Essence 100ml,£70.00,"Aqua / Water / Eau, Glycerin, Sorbitol, Polysorbate 20, Benzyl Alcohol, Macrocystis Pyrifera (Kelp / Varech) Extract, Tartaric Acid, Aloe Barbadensis (Aloe Vera) Leaf Extract, Tetrahexyldecyl Ascorbate, Xanthan Gum, Peg-20 Glyceryl Laurate, Maltodextrin, Sodium Hydroxide, Retinyl Palmitate, Aesculus Hippocastanum (Horse Chestnut / Marronnier D'inde) Seed Extract, Disodium Edta, Tocopherol, Linoleic Acid, Acetyl Cysteine, Phenoxyethanol, Diethylhexyl Syringylidenemalonate, Caprylic/Capric Triglyceride, Sodium Carbonate, Sodium Chloride, Ci 75810 / Chlorophyllin-Copper Complex, Sodium Ascorbyl Phosphate, Parfum / Fragrance.",https://www.lookfantastic.com/111skin-antioxidant-energising-essence-100ml/12743435.html,Exfoliators
Sarah Chapman Skinesis Overnight Exfoliating Booster (30ml),£51.75,"Aqua (Water), Propanediol, Polysorbate 20, Lactic Acid, Cyclopentasiloxane, Glycerin, Dimethicone, PEG-8 Dimethicone, Xanthan Gum, Cyclohexasiloxane, Salix Alba (Willow) Bark Extract, Phenoxyethanol, Lens Esculenta (Lentil) Seed Extract, Caprylyl Glycol, Ethylhexylglycerin, Hexylene Glycol, Rosa Damascena Flower Oil, Retinol, Hydrolyzed Opuntia Ficus-Indica Flower Extract, Hydrolyzed Ceratonia Siliqua Seed Extract, Citronellol, Geraniol, Eugenol.",https://www.lookfantastic.com/sarah-chapman-skinesis-overnight-exfoliating-booster-30ml/10448978.html,Exfoliators
Benton Deep Green Tea Serum 30ml,£17.00,"Camellia Sinensis Leaf Wter, Aqua(Water, Glycerin, Butylene Glycol, Pentylene Gycol, 1,2-Hexanediol, Camellia Sinensis Leaf Extract, Camellia Sincensis Root Extract, Camellia Sinensis Seed Extract, Betaine Panthenol, Houttuynia Cordata Extract, Centlla Asiatica Extract, Salix Nigra(Willow) Bark Extract Salix Alba(Willow)  Bark Extract, Punica Granatum Fruit Extract, Sodium Hyaluronate Hydolyzed Sodium hyaluronate, Hyaluronic Acid, Biosaccharide Gim-1, Cellulose Gum, Caprylyl Glycol Camellia Japonica Seed Oil, Madecassoside, Ethylhexylglycerin, Caprylic/Capric Triglyceride, Tocopherol Helianthus Annuus (Sunflower) Seed Oil, Polyglyceryl-10 Laurate, Propanediol, l Camellia Sinensis Leaf Water (500,000ppm), EG-Green Tea (Camellia Sinensis Leaf Extract, Camellia Sincensis Seed Extract, Camellia Sinensis Root Extract 35,000ppm).",https://www.lookfantastic.com/benton-deep-green-tea-serum-30ml/12675941.html,Exfoliators
ManCave Charcoal Face Scrub 100ml,£10.00,"Aqua (Water), Cetearyl Alcohol, Decyl Glucoside, Caprylic/Capric Triglyceride, Cetyl Esters, Pumice, Glycerin, Butyrospermum Parkii (Shea) Butter, Charcoal Powder, Phenoxyethanol, Helianthus Annuus (Sunflower) Seed Wax, Carbomer, Parfum (Fragrance), Benzoic Acid, Rhus Verniciflua Peel Wax, Shorea Robusta Resin, Arginine, Caffeine, Menthol, Panthenol, Dehydroacetic Acid, Epilobium Fleischeri Extract, Linalool, Tocopherol, Sodium Hydroxide, Bulnesia Sarmientoi Wood Oil, Benzyl Salicylate, Hexyl Cinnamal, Abies Sibirica Oil, Artemisia Herba-Alba Oil, Cedrus Atlantica Bark Oil, Citrus Aurantifolia (Lime) Oil, Eucalyptus Globulus Leaf Oil, Lavandula Hybrida Oil, Origanum Majorana Herb Oil, Rosmarinus Officinalis (Rosemary) Leaf Oil, Coumarin, Abies Balsamea (Balsam Canada) Extract, Citric Acid, Juniperus Communis Fruit Oil, Piper Nigrum (Pepper) Fruit Oil, Thymus Vulgaris (Thyme) Flower/Leaf Oil, Potassium Sorbate, Ascorbyl Palmitate.",https://www.lookfantastic.com/mancave-charcoal-face-scrub-100ml/12071338.html,Exfoliators
Super Facialist Retinol+ Anti-Ageing Renewing Night Cream 50ml,£20.00,"Aqua (Water), Cetearyl Ethylhexanoate, Glycerin, Prunus Amygdalus Dulcis (Sweet Almond) Oil, Cetearyl Alcohol, Caprylic/Capric Triglyceride, Cyclopentasiloxane, Polyacrylate-13, Phenoxyethanol, Cetearyl Glucoside, Parfum (Fragrance), Helianthus Annuus (Sunflower) Seed Oil, Polyisobutene, Camellia Sinesis (White Tea) Leaf Extract, Propylene Glycol, Retinyl Palmitate, Benzoic Acid, Disodium Edta, Polysorbate 20, Dehydroacetic Acid, Sorbitan Isostearate, Sodium Hyaluronate, Prunus Armeniaca (Apricot) Fruit Extract, Sodium Hydroxide, Lupinus Albus (White Lupin) Seed Extract, Potassium Sorbate, Sodium Benzoate, Tocopherol, Hexyl Cinnamal, Hydroxyisohexyl 3-Cyclohexene Carboxaldehyde, Butylphenyl Methylpropional, Limonene, Alpha-Isomethyl Ionone.",https://www.lookfantastic.com/super-facialist-retinol-anti-ageing-renewing-night-cream-50ml/13209607.html,Exfoliators
Super Facialist Retinol+ Anti-Ageing Renewing Day Cream - 50ml,£20.00,"Aqua (Water), Cyclopentasiloxane, C12-15 Alkyl benzoate, Glycerin, Polyacrylate-13, Pentaerythrityl distearate, Phenoxyethanol, Butyrospermum parkii (Shea butter), Parfum (Fragrance), Helianthus annuus (Sunflower) seed oil, Polyisobutene, Sodium polyacrylate, Camellia sinesis (White tea) leaf extract, Propylene glycol, Sodium stearoyl glutamate, Potassium sorbate, Retinyl palmitate, Benzoic acid, Polysorbate 20, Dehydroacetic acid, Sorbitan isostearate, Disodium EDTA, Sodium hyaluronate, Prunus armeniaca (Apricot) fruit extract, Glyceryl acrylate/acrylic acid copolymer, Lupinus albus (White lupin) seed extract, Sodium benzoate, Tocopherol, Hexyl cinnamal, Hydroxyisohexyl 3-cyclohexene carboxaldehyde, Butylphenyl methylpropional, Limonene, Alpha-isomethyl ionone.",https://www.lookfantastic.com/super-facialist-retinol-anti-ageing-renewing-day-cream-50ml/13209608.html,Exfoliators
The Organic Pharmacy Hyaluronic Acid Serum 30ml,£21.00,"Hamamelis Virginiana Water, Glycerin, Sodium Lactate, Aqua (Water), Citrus Grandis Peel Oil, Algin, Sodium Hyaluronate, Dehydroacetic Acid, Benzyl Alcohol, Chondrus Crispus (Carrageenan), Xanthan Gum, Sorbic Acid, Limonene, Citral, Linalool, Hyaluronic Acid, Grapefruit Oil, Witch Hazel,, Hamamelis Virginiana Water, Glycerin, Sodium Lactate, Aqua (Water), Citrus Grandis Peel Oil, Algin, Sodium Hyaluronate, Dehydroacetic Acid, Benzyl Alcohol, Chondrus Crispus (Carrageenan), Xanthan Gum, Sorbic Acid, Limonene, Citral, Linalool, Hyaluronic Acid, Grapefruit Oil, Witch Hazel.",https://www.lookfantastic.com/the-organic-pharmacy-hyaluronic-acid-serum-30ml/12100162.html,Exfoliators
Chantecaille Rice & Geranium Foaming Cleanser 75ml,£55.00,"Water/Aqua, Potassium Myristate, Glycerin, Potassium Stearate, Myristic Acid, Butylene Glycol, Sodium Lauroyl Glutamate, Stearic Acid, Glyceryl Sterate, Lauramide Dea, Citrus Aurantium Dulcis (Orange) Flower Water, Butyrospermum Parkii (Shea Butter) Fruit, Squlane, Behenyl Alcohol, Methylmethacrylate Cross Polymer, Oryza Sativa (Rice) Bran Extract, Pelargonium Graveolens Flower Oil, Fucus Vesiculosus Extract, Natto Gum, Olea Europaea (Olive) Leaf Extract, Hydrolyzed Wheat Protein, Dipotassium Glycyrrhizate, Lithospermum Erythrorhizone Root Extract, Alcohol, Methylparaben, Butylparaben, Disodium Edta",https://www.lookfantastic.com/chantecaille-rice-geranium-foaming-cleanser-75ml/11219094.html,Exfoliators
Neostrata Resurface Glycolic Renewal Smoothing Lotion for Face & Body 200ml,£53.00,"Aqua/Water/Eau, Glycolic Acid, Propylene Glycol, Citric Acid, Ammonium Hydroxide, Arginine, Dimethicone, PEG-40 Stearate, Trimethylolpropane Triethylhexanoate, Mangifera Indica (Mango) Seed Butter, Tocopheryl Acetate, Glycerin, Butylene Glycol, PEG-100 Stearate, Glyceryl Stearate, Isopropyl Palmitate, Stearic Acid, Myristic Acid, Palmitic Acid, Cetearyl Alcohol, Cetyl Hydroxyethylcellulose, Xanthan Gum, Stearamidopropyl Dimethylamine, Disodium EDTA, Methylparaben, Chlorphenesin.",https://www.lookfantastic.com/neostrata-resurface-glycolic-renewal-smoothing-lotion-for-face-body-200ml/12052781.html,Exfoliators
Super Facialist Vitamin C+ Brighten Sleep and Reveal Night Cream - 50ml,£17.00,"Aqua (Water), Cyclopentasiloxane, Glycerin, Cetyl Alcohol, Isostearyl Isostearate, Polyacrylate-13, Butyrospermum Parkii (Shea) Butter, Pentaerythrityl Distearate, Phenoxyethanol, Polyisobutene, Sodium Ascorbyl Phosphate, Parfum (Fragrance), Sodium Stearoyl Glutamate, Allantoin, Benzoic Acid, Disodium EDTA, Sodium Polyacrylate, Polysorbate 20, Propylene Glycol, Solanum Lycopersicum (Tomato) Fruit Extract, Sorbitan Isostearate, Dehydroacetic Acid, Citric Acid, Limonene, Emblica Officinalis Fruit Extract, Sodium Hyaluronate, Tocopheryl Acetate, Glyceryl Acrylate/Acrylic Acid Copolymer, Citral, Glycyrrhiza Glabra (Licorice) Root Extract, Hydroxycitronellal, Linalool, Tromethamine.",https://www.lookfantastic.com/super-facialist-vitamin-c-brighten-sleep-and-reveal-night-cream-50ml/13209621.html,Exfoliators
Peter Thomas Roth FirmX Peeling Gel 100ml,£47.00,"Water/Aqua/Eau, Peg-32, Cellulose, Butylene Glycol, Citrus Aurantium Bergamia (Bergamot) Fruit Water, Sorbitol, R-Bacillus Licheniformis Keratinase, Ananas Sativus (Pineapple) Fruit Extract, Lactobacillus/Punica Granatum Fruit Ferment Extract, Leuconostoc/Radish Root Ferment Filtrate, Sodium Hyaluronate, Glycerin, Sodium Hydroxide, Citric Acid, Tetrasodium Edta, Algin, Carbomer, Tromethamine, Isopropyl Myristate, Sodium Chloride, Calcium Chloride, Potassium Sorbate, Sodium Benzoate, Mica, Phenoxyethanol.",https://www.lookfantastic.com/peter-thomas-roth-firmx-peeling-gel-100ml/11289133.html,Exfoliators
Elemis Gentle Rose Exfoliator 50ml,£33.15,"Aqua/Water/Eau, Glycerin, Propylene Glycol, Jojoba Esters, PEG/PPG-14/4 Dimethicone, Polysorbate 20, Phenoxyethanol, PEG-120 Methyl Glucose Dioleate, Carbomer, Tromethamine, Sodium PCA, 1,2-Hexanediol, Caprylyl Glycol, Ethylhexylglycerin, Disodium EDTA, Rosa Damascena (Rose) Flower Oil, Citronellol, Cucumis Sativus (Cucumber) Fruit Extract, Fragrance (Parfum), Tocopherol, Sodium Chloride, CI 14700 (Red 4).",https://www.lookfantastic.com/elemis-gentle-rose-exfoliator-50ml/10437938.html,Exfoliators
Neostrata Clarify Sheer Hydration Sunscreen with SPF 40 for Blemish-Prone Skin 50ml,£53.00,"Aqua/Water/Eau, Acetyl Glucosamine, Ethylhexl Methoxycinnamate, Ethylhexyl Salicylate, Butyloctyl Salicylate, Cyclopentasiloxane, Glycerin, Dimethicone, C12-15 Alkyl Benzoate, Butyl Methoxydibenzoylmethane, Butylene Glycol, Glyceryl Stearate, Octyldodecyl Neopentanoate, Cetyl Alcohol, PEG-100 Stearate, Cetearyl Alcohol, Vitis Vinifera (Grape) Seed Extract, Melia Azadirachta Leaf Extract, Lecithin, Arctium Lappa Root Extract, Tocopheryl Acetate, Dimethicone Crosspolymer, Propylene Glycol, PEG-75 Stearate, Steareth-20, Xanthan Gum, Ceteth-20, Carbomer, Ammonium Hydroxide, Disodium EDTA, Caprylyl Glycol, Phenoxyethanol, Chlorphenesin, Sodium Bisulfite.",https://www.lookfantastic.com/neostrata-clarify-sheer-hydration-sunscreen-with-spf-40-for-blemish-prone-skin-50ml/12717653.html,Exfoliators
Clinique Moisture Surge 100H Auto-Replenishing Hydrator Jumbo 125ml,£79.00,"Water\Aqua\Eau, Dimethicone, Butylene Glycol, Glycerin, Trisiloxane, Trehalose, Sucrose, Ammonium Acryloyldimethyltaurate/Vp Copolymer, Hydroxyethyl Urea, Camellia Sinensis (Green Tea) Leaf Extract, Silybum Marianum (Lady's Thistle) Extract, Betula Alba (Birch) Bark Extract, Saccharomyces Lysate Extract, Aloe Barbadensis Leaf Water, Aloe Barbadensis Leaf Extract, Thermus Thermophillus Ferment, Caffeine, Sorbitol, Palmitoyl Hexapeptide-12, Sodium Hyaluronate, Caprylyl Glycol, Oleth-10, Sodium Polyaspartate, Aloe Barbadensis Leaf Polysaccharides, Lactobacillus Ferment Lysate, Saccharide Isomerate, Hydrogenated Lecithin, Tocopheryl Acetate, Acrylates/C10-30 Alkyl Acrylate Crosspolymer, Glyceryl Polymethacrylate, Tromethamine, Peg-8, Hexylene Glycol, Magnesium Ascorbyl Phosphate, Citric Acid, Bht, Disodium Edta, Sodium Citrate, Potassium Sorbate, Sodium Benzoate, Phenoxyethanol, Red 4 (CI 14700), Yellow 5 (CI 19140).",https://www.lookfantastic.com/clinique-moisture-surge-100h-auto-replenishing-hydrator-jumbo-125ml/12947143.html,Exfoliators
Clinique Moisture Surge 100 Hour Auto-Replenishing Hydrator 75ml,£56.00,"Water\Aqua\Eau, Dimethicone, Butylene Glycol, Glycerin, Trisiloxane, Trehalose, Sucrose, Ammonium Acryloyldimethyltaurate/Vp Copolymer, Hydroxyethyl Urea, Camellia Sinensis (Green Tea) Leaf Extract, Silybum Marianum (Lady's Thistle) Extract, Betula Alba (Birch) Bark Extract, Saccharomyces Lysate Extract, Aloe Barbadensis Leaf Water, Aloe Barbadensis Leaf Extract, Thermus Thermophillus Ferment, Caffeine, Sorbitol, Palmitoyl Hexapeptide-12, Sodium Hyaluronate, Caprylyl Glycol, Oleth-10, Sodium Polyaspartate, Aloe Barbadensis Leaf Polysaccharides, Lactobacillus Ferment Lysate, Saccharide Isomerate, Hydrogenated Lecithin, Tocopheryl Acetate, Acrylates/C10-30 Alkyl Acrylate Crosspolymer, Glyceryl Polymethacrylate, Tromethamine, Peg-8, Hexylene Glycol, Magnesium Ascorbyl Phosphate, Citric Acid, Bht, Disodium Edta, Sodium Citrate, Potassium Sorbate, Sodium Benzoate, Phenoxyethanol, Red 4 (CI 14700), Yellow 5 (CI 19140).",https://www.lookfantastic.com/clinique-moisture-surge-100-hour-auto-replenishing-hydrator-75ml/12947142.html,Exfoliators
Sarah Chapman Skinesis Skin Tone Perfecting Booster (30ml),£51.75,"Aqua (Water), Glycerin, Cyclopentasiloxane, PEG-8 Dimethicone, Sodium Ascorbyl Phosphate, Cyclohexasiloxane, Ergothioneine, Dimethicone, Polysorbate 20, Xanthan Gum, Phenoxyethanol, Caprylyl Glycol, Palmaria Palmata Extract, Ethylhexylglycerin, Hexylene Glycol, Arctostaphylos Uva Ursi Leaf Extract, Allantoin, Arbutin, Alcohol, Rosa Damascena Flower Oil, Malva Sylvestris (Mallow) Extract, Mentha Piperita (Peppermint) Leaf Extract, Primula Veris Extract, Alchemilla Vulgaris Extract, Veronica Officinalis Extract, Melissa Officinalis Leaf Extract, Achillea Millefolium Extract, Citronellol, Geraniol.",https://www.lookfantastic.com/sarah-chapman-skinesis-skin-tone-perfecting-booster-30ml/10448979.html,Exfoliators
FaceGym Supreme Restructure Firming EGF Collagen Boosting Cream (Various Sizes),£30.00,"Aqua / Water / Eau, Glycerin, Lactococcus Ferment Lysate, Squalane, Caprylic/ Capric Triglyceride, Niacinamide, Cetearyl Ethylhexanoate, Cetearyl Alcohol, Limnanthes Alba (Meadowfoam) Seed Oil, Butylene Glycol, Hordeum Vulgare (Barley) Seed Extract/Extrait De Semence D'orge, Helianthus Annuus (Sunflower) Seed Oil, Jojoba Esters, Betaine, Helianthus Annuus (Sunflower) Seed Wax, Sodium Pca, Plankton Extract, PCA, Serine, Alanine, Glycine, Ceramide Np, Glutamic Acid, Ceramide Ap, Phytosphingosine, Cholesterol, Lysine Hcl, Threonine, Arginine, Bacillus Ferment, Proline, Hexapeptide-9, Ceramide Eop, Oligopeptide-1, Xanthan Gum, Glyceryl Stearate, Sodium Stearoyl Glutamate, Sodium Lauroyl Lactylate, Polyglycerin-3, Lactic Acid, Carbomer, Sodium Chloride, Sodium Lactate, Tocopherol, Sodium Dehydroacetate, Benzyl Alcohol, Dehydroacetic Acid, Sodium Benzoate, Phenoxyethanol, Ethylhexylglycerin, Citric Acid, Sodium Hydroxide.",https://www.lookfantastic.com/facegym-supreme-restructure-firming-egf-collagen-boosting-cream-various-sizes/13805254.html,Exfoliators
ALGENIST GENIUS Sleeping Collagen 60ml,£88.00,"Collagen, Water (Aqua, Eau), Ethylhexyl Palmitate, Oryza Sativa (Rice) Bran Extract, Caprylic/Capric Triglyceride, Glycerin, Cetearyl Methicone, Dimethicone, Cetearyl Alcohol, Pyrus Malus (Apple) Fruit Extract, Chlorella Protothecoides Oil, Polysorbate 60, Glyceryl Glucoside , Polyglyceryl-2 Stearate, Parachlorella Beijerinckii Exopolysaccharides, Collagen Amino Acids, Ceramide NP, Silybum Marianum Fruit Extract, Helianthus Annuus (Sunflower) Extract, Rosmarinus Officinalis (Rosemary) Leaf Extract, Tocopherol, Carnosine, Sodium Stearoyl Glutamate, Caprylyl Glycol, Ammonium Acryloyldimethyltaurate/VP Copolymer, Ethylhexylglycerin, Hexylene Glycol, Citric Acid, Lecithin, Sodium Hydroxide, Sodium Phytate, t-Butyl Alcohol, Leuconostoc/Radish Root Ferment Filtrate, Phenoxyethanol, Triethyl Citrate, Vanillin, Amyl Salicylate, Benzyl Acetate, Cedrus Atlantica Bark Oil, Phenethyl Alcohol, Ionone, Linalool.",https://www.lookfantastic.com/algenist-genius-sleeping-collagen-60ml/12032504.html,Exfoliators
